{
  "version": "2026-07-16.v1",
  "tiers": {
    "primary": {
      "description": "Default first-line changes with a narrow blast radius and a direct connection to observed call behavior, primarily prompt and greeting changes."
    },
    "feature": {
      "description": "Use or correct an existing HighLevel capability when prompt wording alone cannot supply data, execute an action, or complete an operational workflow."
    },
    "advanced": {
      "description": "Speech, model, system-prompt, and other high-coupling settings that require stronger causal evidence and explicit testing before adoption."
    }
  },
  "sources": {
    "create-agent-ui": {
      "title": "How to Create Voice AI Agents",
      "url": "https://help.gohighlevel.com/support/solutions/articles/155000004107-creating-voice-ai-agents"
    },
    "patch-agent-api": {
      "title": "Patch Voice AI Agent API",
      "url": "https://marketplace.gohighlevel.com/docs/ghl/voice-ai/patch-agent/"
    },
    "oauth-scopes": {
      "title": "HighLevel OAuth scopes",
      "url": "https://marketplace.gohighlevel.com/docs/Authorization/Scopes/"
    },
    "actions-ui": {
      "title": "Separate During-Call and Post-Call Actions",
      "url": "https://help.gohighlevel.com/support/solutions/articles/155000005267-separate-during-call-and-post-call-actions-in-voice-ai"
    },
    "actions-api": {
      "title": "Voice AI Actions API",
      "url": "https://marketplace.gohighlevel.com/docs/ghl/voice-ai/actions/"
    },
    "agent-transfer": {
      "title": "Voice AI Agent Transfer",
      "url": "https://help.gohighlevel.com/support/solutions/articles/155000007796-voice-ai-agent-transfer"
    },
    "appointment-booking": {
      "title": "Appointment Booking in Voice AI",
      "url": "https://help.gohighlevel.com/support/solutions/articles/155000005293-appointment-booking-in-voice-ai"
    },
    "kb-integration": {
      "title": "Knowledge Base Integration for Voice AI Agents",
      "url": "https://help.gohighlevel.com/support/solutions/articles/155000005266-knowledge-base-integration-for-voice-ai-agents"
    },
    "kb-overview": {
      "title": "Knowledge Base Overview",
      "url": "https://help.gohighlevel.com/support/solutions/articles/155000007313-knowledge-base-overview"
    },
    "kb-documents": {
      "title": "Knowledge Base Document and Rich-Text Support",
      "url": "https://help.gohighlevel.com/support/solutions/articles/155000006671"
    },
    "idle-reminder": {
      "title": "Voice AI Idle Reminder Timer",
      "url": "https://help.gohighlevel.com/support/solutions/articles/155000005207-idle-reminder-timer"
    },
    "noise-backchannel": {
      "title": "Voice AI Noise Cancellation and Backchanneling",
      "url": "https://help.gohighlevel.com/support/solutions/articles/155000007002-voice-ai-noise-cancellation-backchanneling"
    },
    "translation": {
      "title": "Voice AI Translation Service",
      "url": "https://help.gohighlevel.com/support/solutions/articles/155000005797-voice-ai-translation-service-for-call-transcript-summary"
    },
    "voice-selection": {
      "title": "Voice AI Voice Selection and Voice Models",
      "url": "https://help.gohighlevel.com/support/solutions/articles/155000005874-how-to-edit-a-voice-ai-agents-voice"
    },
    "system-prompts": {
      "title": "Exposed System Prompts for Voice AI Agents",
      "url": "https://help.gohighlevel.com/support/solutions/articles/155000007215"
    },
    "performance-reports": {
      "title": "Voice AI Performance Reports",
      "url": "https://help.gohighlevel.com/support/solutions/articles/155000007984-voice-ai-performance-reports"
    },
    "outbound": {
      "title": "Voice AI Outbound Calling",
      "url": "https://help.gohighlevel.com/support/solutions/articles/155000006598-voice-ai-outbound-calling"
    },
    "prompt-optimizer": {
      "title": "Voice AI Prompt Optimizer",
      "url": "https://help.gohighlevel.com/support/solutions/articles/155000007781-voice-ai-prompt-optimizer"
    },
    "custom-values": {
      "title": "Use Custom Values in Voice AI Prompts",
      "url": "https://help.gohighlevel.com/support/solutions/articles/155000004690"
    }
  },
  "suggestions": [
    {
      "id": "prompt.core-instructions",
      "tier": "primary",
      "category": "prompt",
      "title": "Clarify the agent's role, flow, and success criteria",
      "uiPath": "Build > Agent prompt",
      "applicationMode": "api_or_manual_ui",
      "api": {
        "status": "documented_write",
        "field": "agentPrompt",
        "scope": "voice-ai-agents.write"
      },
      "evidencePolicy": "single_call_can_suffice",
      "requiredEvidence": ["current agent prompt", "quoted transcript evidence"],
      "signals": [
        "The agent skips an explicit requirement",
        "The agent follows an ambiguous instruction in a harmful or unhelpful way",
        "The call exposes a missing branch or fallback"
      ],
      "guardrails": [
        "Propose an exact minimal diff",
        "Preserve unrelated instructions and custom values",
        "Do not solve missing knowledge or missing tools with invented prompt facts"
      ],
      "validation": [
        "Run the failing scenario and at least one unaffected happy path",
        "Review transcript, action use, and outcome before applying"
      ],
      "sourceIds": ["create-agent-ui", "patch-agent-api", "prompt-optimizer"]
    },
    {
      "id": "prompt.action-trigger-instructions",
      "tier": "primary",
      "category": "prompt",
      "title": "Clarify when and how an existing action should be used",
      "uiPath": "Build > Agent prompt and Actions",
      "applicationMode": "api_or_manual_ui",
      "api": { "status": "partial", "field": "agentPrompt", "scope": "voice-ai-agents.write" },
      "evidencePolicy": "single_call_can_suffice",
      "requiredEvidence": [
        "configured action details",
        "executed action evidence or a conclusive missed trigger",
        "quoted transcript evidence"
      ],
      "signals": [
        "A configured action is invoked under the wrong condition",
        "The prompt omits the trigger or required preconditions",
        "The agent announces an action but does not invoke it"
      ],
      "guardrails": [
        "Never infer failure from an empty action list without knowing the action configuration",
        "Separate prompt-trigger defects from action configuration or downstream execution failures"
      ],
      "validation": [
        "Test positive, negative, and boundary trigger scenarios",
        "Confirm the expected action ID and result"
      ],
      "sourceIds": ["create-agent-ui", "actions-ui", "actions-api", "prompt-optimizer"]
    },
    {
      "id": "prompt.fallback-boundaries",
      "tier": "primary",
      "category": "prompt",
      "title": "Add a safe fallback or explicit boundary",
      "uiPath": "Build > Agent prompt",
      "applicationMode": "api_or_manual_ui",
      "api": {
        "status": "documented_write",
        "field": "agentPrompt",
        "scope": "voice-ai-agents.write"
      },
      "evidencePolicy": "single_call_can_suffice",
      "requiredEvidence": [
        "current agent prompt",
        "quoted unsupported, unsafe, or fabricated response"
      ],
      "signals": [
        "The agent invents business information",
        "The agent does not know how to handle an unsupported request",
        "The agent should escalate or collect a message instead of continuing"
      ],
      "guardrails": [
        "Prefer a narrow condition and next step over a blanket refusal",
        "Do not promise a handoff mechanism that is not configured"
      ],
      "validation": [
        "Retest the original failure",
        "Test a supported neighboring request to prevent over-refusal"
      ],
      "sourceIds": ["create-agent-ui", "patch-agent-api", "prompt-optimizer"]
    },
    {
      "id": "greeting.inbound-outbound",
      "tier": "primary",
      "category": "greeting",
      "title": "Correct or specialize the inbound/outbound greeting",
      "uiPath": "Build > Welcome Message > Inbound or Outbound",
      "applicationMode": "api_or_manual_ui",
      "api": { "status": "partial", "field": "welcomeMessage", "scope": "voice-ai-agents.write" },
      "evidencePolicy": "single_call_can_suffice",
      "requiredEvidence": ["call direction", "current greeting", "opening transcript or recording"],
      "signals": [
        "Wrong business or agent identity",
        "Outbound purpose is not explained",
        "Greeting language or tone conflicts with the configured audience"
      ],
      "guardrails": [
        "Do not claim separate inbound/outbound API writes because the public API documents one welcomeMessage field",
        "Preserve required disclosures"
      ],
      "validation": ["Run one inbound and one outbound opening test when both are used"],
      "sourceIds": ["create-agent-ui", "patch-agent-api", "outbound"]
    },
    {
      "id": "greeting.pause-before-speaking",
      "tier": "primary",
      "category": "greeting",
      "title": "Adjust the pause before the greeting",
      "uiPath": "Build > Welcome Message > Pause Before Speaking",
      "applicationMode": "manual_ui_only",
      "api": { "status": "undocumented", "field": null, "scope": null },
      "evidencePolicy": "pattern_preferred",
      "requiredEvidence": [
        "call recording or timestamped audio events",
        "current pause setting if available"
      ],
      "signals": [
        "The greeting is clipped by call connection audio",
        "Callers repeatedly speak over the opening",
        "The opening delay is conspicuously long"
      ],
      "guardrails": [
        "Never infer this from transcript text alone",
        "Do not recommend a numeric value without audio evidence"
      ],
      "validation": ["Compare test calls at the current and proposed delay"],